{
  "schema": "wordpress-hx.php-readability-review.v1",
  "schemaVersion": 1,
  "receiptId": "g1-php-readability-oracle-2026-07-26",
  "packet": {
    "packetId": "wordpresshx-g1-php-readability-v1",
    "implementationCommit": "d6f74f9ac009862f0f65b2a46c67b69999b7fea9",
    "manifestSha256": "787f3a9e787f1576758122436658487f3b972d7c636657be63335cec83204c31",
    "packetDigest": "d107a8d8f7cfd0668b1281161fd37e9ec267e23170372d84168adf2a19b06a6b"
  },
  "reviewer": {
    "name": "Oracle",
    "role": "Independent Oracle using a senior WordPress and PHP review perspective",
    "wordpressPhpExperience": "This Oracle applied the requested native WordPress plugin, PHP ABI, generated-code, and operational debugging review perspective; it does not claim human credentials.",
    "reviewContext": {
      "kind": "oracle-agent",
      "provider": "OpenAI",
      "model": "GPT-5.6",
      "promptSha256": "ed22561d3393e340c00548d4c3ffc15e4517c1fe83329ea773b0638bee7bb559",
      "repositorySnapshotSha256": "c7182305f8e3b51a8ff59e2cd85fd8be753121673fbc80b856c77747a17bdba3"
    },
    "independence": {
      "implementedEmitter": false,
      "contributedToReviewedCommit": false,
      "preparedPacket": false,
      "statement": "I did not implement the reviewed emitter, contribute to the reviewed implementation commit, or prepare this evidence packet."
    }
  },
  "reviewedAt": "2026-07-26",
  "decision": "accepted",
  "categories": [
    {
      "id": "ordinary-php-naming-and-shape",
      "outcome": "accepted",
      "notes": "Namespaces, stable class and method names, scalar and WordPress nominal types, references, visibility, arrays, and ordinary control flow are recognizable to an experienced PHP reader and callable without a Haxe runtime.",
      "evidencePaths": [
        "php/acme-books-adapters/includes/PublicAdapters.php",
        "callers/native-adapter-caller.php",
        "artifact-manifests/wordpresshx-public-php-adapters.v1.json"
      ],
      "findingIds": []
    },
    {
      "id": "wordpress-conventions",
      "outcome": "accepted",
      "notes": "The root file has a normal plugin header and ABSPATH guard; it owns activation registration, and the generated registration file uses ordinary action, filter, REST, and dynamic-block callbacks with explicit priorities and accepted argument counts.",
      "evidencePaths": [
        "php/acme-books-adapters/acme-books-adapters.php",
        "php/acme-books-adapters/includes/register-adapters.php",
        "php/acme-books-adapters/includes/PublicAdapters.php",
        "callers/probe-adapters.php",
        "evidence/g1.3-wordpress-activation-hook.json"
      ],
      "findingIds": []
    },
    {
      "id": "control-flow-and-bootstrap",
      "outcome": "accepted",
      "notes": "The load path is short and inspectable: plugin root, eager local includes, activation registration, idempotent bootstrap, then WordPress-owned callback dispatch. One naming observation does not obscure or change that flow.",
      "evidencePaths": [
        "php/acme-books-adapters/acme-books-adapters.php",
        "php/acme-books-adapters/includes/autoload.php",
        "php/acme-books-adapters/includes/Bootstrap.php",
        "php/acme-books-adapters/includes/register-adapters.php"
      ],
      "findingIds": [
        "g1-finding-002"
      ]
    },
    {
      "id": "adapters-and-private-boundary",
      "outcome": "accepted",
      "notes": "WordPress-facing methods are public native static callables, helper methods remain private, and the private failure path stays visible in ordinary PHP frames without publishing a second runtime ABI.",
      "evidencePaths": [
        "php/acme-books-adapters/includes/PublicAdapters.php",
        "php/source-correlation/includes/FailureCallbacks.php",
        "callers/source-correlation-caller.php",
        "evidence/sdk-024-private-php-runtime.json"
      ],
      "findingIds": []
    },
    {
      "id": "errors-and-native-stack-frames",
      "outcome": "accepted",
      "notes": "Hook, REST, render, and private failures retain the native exception class, message, generated PHP path and line, callable sequence, and unmapped frames. Correlation adds annotations without replacing native text.",
      "evidencePaths": [
        "traces/hook.native.stack",
        "traces/private.native.stack",
        "traces/render.native.stack",
        "traces/rest.native.stack",
        "traces/private.correlated.json"
      ],
      "findingIds": []
    },
    {
      "id": "haxe-source-correlation",
      "outcome": "accepted",
      "notes": "The current generated PHP digest is bound by the range map and packet manifest; source identities are project-relative, statement anchors point to the corresponding Haxe throws, and ambiguous intermediate frames remain explicitly unmapped. A stale digest in one supplemental historical receipt should be refreshed.",
      "evidencePaths": [
        "debug/source-index.json",
        "debug/includes/FailureCallbacks.php.haxe-map.json",
        "haxe/fixtures/SourceCorrelationCallbacks.hx",
        "traces/hook.correlated.json",
        "traces/private.correlated.json",
        "traces/render.correlated.json",
        "traces/rest.correlated.json",
        "evidence/sdk-025-php-source-correlation.json"
      ],
      "findingIds": [
        "g1-finding-001"
      ]
    }
  ],
  "findings": [
    {
      "id": "g1-finding-001",
      "category": "haxe-source-correlation",
      "severity": "non-blocking",
      "summary": "The supplemental SDK-025 receipt identifies an older FailureCallbacks.php digest than the current content-bound map and packet.",
      "evidencePaths": [
        "evidence/sdk-025-php-source-correlation.json",
        "debug/includes/FailureCallbacks.php.haxe-map.json",
        "php/source-correlation/includes/FailureCallbacks.php",
        "packet-manifest.json"
      ],
      "resolution": "accepted-non-blocking",
      "resolutionNotes": "The receipt records e2612cf416877983e712c930ee6fc0e36ccd3f37c451b964a8f5af990ee7e157, while the reviewed PHP, map, and packet manifest bind d3534a6374ebec4ded2265850d93fb0be6f2b73c55f4ac213cbb6e811db00dc2. The current map and all supplied traces remain mutually consistent, so readability and debuggability are demonstrated; refresh or clearly label the supplemental receipt before using it as current artifact evidence.",
      "resolutionEvidencePaths": [
        "debug/includes/FailureCallbacks.php.haxe-map.json",
        "traces/private.correlated.json",
        "packet-manifest.json"
      ]
    },
    {
      "id": "g1-finding-002",
      "category": "control-flow-and-bootstrap",
      "severity": "observation",
      "summary": "The file named autoload.php is an eager include graph and executes adapter registration while being required.",
      "evidencePaths": [
        "php/acme-books-adapters/includes/autoload.php",
        "php/acme-books-adapters/includes/register-adapters.php",
        "php/acme-books-adapters/acme-books-adapters.php"
      ],
      "resolution": "accepted-non-blocking",
      "resolutionNotes": "The behavior is local, short, and fully visible, and the root-to-registration path is easy to follow. A generated comment or a name such as includes.php would reduce the chance that a PHP reader assumes PSR-style lazy autoloading, but no hidden framework indirection or debugging blocker results.",
      "resolutionEvidencePaths": [
        "php/acme-books-adapters/includes/autoload.php",
        "php/acme-books-adapters/includes/register-adapters.php"
      ]
    }
  ],
  "confirmation": {
    "allBlockingFindingsResolved": true,
    "publicationAuthorized": false,
    "productionSupportClaimed": false,
    "attestation": "I reviewed all six required categories against the identified content-addressed packet. The decision is limited to generated PHP readability and debuggability and does not authorize publication or claim production support."
  },
  "receiptDigest": "d69f6c9522f541cf9de9d925db829bbfd072bf3329dcb55cb67124cfea9c8a38"
}
